{
  "$schema": "http://json-schema.org/draft-07/schema#",
  "type": "object",
  "properties": {
    "style": {
      "type": "string",
      "enum": ["default", "new-york"]
    },
    "tailwind": {
      "type": "object",
      "properties": {
        "config": {
          "type": "string"
        },
        "css": {
          "type": "string"
        },
        "baseColor": {
          "type": "string"
        },
        "cssVariables": {
          "type": "boolean"
        },
        "prefix": {
          "type": "string"
        }
      },
      "required": ["config", "css", "baseColor", "cssVariables"]
    },
    "rsc": {
      "type": "boolean"
    },
    "tsx": {
      "type": "boolean"
    },
    "iconLibrary": {
      "type": "string"
    },
    "aliases": {
      "type": "object",
      "properties": {
        "utils": {
          "type": "string"
        },
        "shadcn": {
          "type": "string"
        },
        "ui": {
          "type": "string"
        },
        "lib": {
          "type": "string"
        }
      },
      "required": ["utils", "shadcn"]
    }
  },
  "required": ["style", "tailwind", "rsc", "aliases"]
}
